[
  {
    "rule_id": "rsi-oversold-bounce",
    "name": "RSI Oversold Bounce Scanner",
    "description": "Identifies oversold RSI conditions for potential bounce signals",
    "rule_type": "technical",
    "enabled": true,
    "priority": 40,
    "conditions": {
      "time_window": {
        "start": "09:35",
        "end": "15:15"
      },
      "technical_conditions": {
        "rsi": {
          "period": 14,
          "overbought": 70,
          "oversold": 30,
          "condition": "oversold"
        }
      },
      "market_conditions": {
        "min_price": 100,
        "max_price": 5000,
        "min_volume": 100000
      }
    },
    "actions": {
      "signal_type": "BUY",
      "confidence_calculation": "weighted_average",
      "risk_management": {
        "stop_loss_pct": 0.03,
        "take_profit_pct": 0.09,
        "max_position_size_pct": 5
      }
    },
    "metadata": {
      "author": "rule_generator",
      "created_at": "2025-09-08T22:00:00Z",
      "version": "1.0.0",
      "tags": ["technical", "rsi", "momentum"],
      "performance_expectations": {
        "expected_win_rate": 0.62,
        "expected_profit_factor": 1.6
      },
      "risk_assessment": {
        "risk_level": "medium",
        "market_conditions": "bear",
        "liquidity_requirements": "medium",
        "holding_period": "intraday"
      }
    }
  },
  {
    "rule_id": "macd-bullish-crossover",
    "name": "MACD Bullish Crossover Scanner",
    "description": "Identifies bullish MACD crossover signals",
    "rule_type": "technical",
    "enabled": true,
    "priority": 35,
    "conditions": {
      "time_window": {
        "start": "09:30",
        "end": "15:30"
      },
      "technical_conditions": {
        "macd": {
          "fast_period": 12,
          "slow_period": 26,
          "signal_period": 9,
          "condition": "bullish"
        }
      },
      "market_conditions": {
        "min_price": 50,
        "max_price": 2000,
        "min_volume": 50000
      }
    },
    "actions": {
      "signal_type": "BUY",
      "confidence_calculation": "weighted_average",
      "risk_management": {
        "stop_loss_pct": 0.025,
        "take_profit_pct": 0.075,
        "max_position_size_pct": 7
      }
    },
    "metadata": {
      "author": "rule_generator",
      "created_at": "2025-09-08T22:00:00Z",
      "version": "1.0.0",
      "tags": ["technical", "macd", "trend"],
      "performance_expectations": {
        "expected_win_rate": 0.58,
        "expected_profit_factor": 1.4
      },
      "risk_assessment": {
        "risk_level": "medium",
        "market_conditions": "bull",
        "liquidity_requirements": "medium",
        "holding_period": "swing"
      }
    }
  }
]
